{
  "schemaVersion": "3.0",
  "name": "single-pass-u32-exclusive-scan",
  "kernelPath": "../kernels/scan.hlsl",
  "kernelAbiVersion": "hlslperf.raw-buffer.v1",
  "shaderModel": "6_0",
  "workItemCount": 16777216,
  "warmupDispatches": 2,
  "minimumWarmupMilliseconds": 75,
  "measurementBatches": 15,
  "dispatchesPerBatch": 1,
  "minimumBatchMilliseconds": 10,
  "maximumDispatchesPerBatch": 64,
  "maximumCoefficientOfVariation": 0.05,
  "minimumRequiredSpeedup": 1.01,
  "workload": {
    "id": "exclusive-scan-u32-v1",
    "parameters": {
      "elementCount": 16777216,
      "seed": 19088743
    }
  },
  "fixedDefines": {
    "HLSLPERF_SCAN_BACKEND": 3
  },
  "baselineDefines": {
    "HLSLPERF_GROUP_SIZE": 512,
    "HLSLPERF_ELEMENTS_PER_THREAD": 4,
    "HLSLPERF_SINGLE_PASS_ITEMS_SCALE": 1,
    "HLSLPERF_SINGLE_PASS_GROUPS": 256
  },
  "axes": [
    { "name": "HLSLPERF_GROUP_SIZE", "values": [256, 512] },
    { "name": "HLSLPERF_ELEMENTS_PER_THREAD", "values": [2, 4] },
    { "name": "HLSLPERF_SINGLE_PASS_ITEMS_SCALE", "values": [1, 2, 4] },
    { "name": "HLSLPERF_SINGLE_PASS_GROUPS", "values": [32, 64, 128, 256] }
  ]
}
