{
  "schemaVersion": "3.0",
  "name": "histogram-and-prefix-offsets",
  "kernelPath": "../kernels/histogram-prefix.hlsl",
  "kernelAbiVersion": "hlslperf.raw-buffer.v1",
  "shaderModel": "6_0",
  "workItemCount": 4000000,
  "warmupDispatches": 4,
  "minimumWarmupMilliseconds": 75,
  "measurementBatches": 15,
  "dispatchesPerBatch": 4,
  "minimumBatchMilliseconds": 10,
  "maximumDispatchesPerBatch": 256,
  "maximumCoefficientOfVariation": 0.05,
  "minimumRequiredSpeedup": 1.01,
  "workload": {
    "id": "histogram-prefix-u32-v1",
    "parameters": {
      "elementCount": 4000000,
      "seed": 19088743,
      "binCount": 256
    }
  },
  "fixedDefines": {
    "HLSLPERF_HISTOGRAM_BINS": 256
  },
  "baselineDefines": {
    "HLSLPERF_HISTOGRAM_BACKEND": 1,
    "HLSLPERF_GROUP_SIZE": 256,
    "HLSLPERF_ELEMENTS_PER_THREAD": 4,
    "HLSLPERF_VECTOR_WIDTH": 1
  },
  "axes": [
    { "name": "HLSLPERF_HISTOGRAM_BACKEND", "values": [1, 2] },
    { "name": "HLSLPERF_GROUP_SIZE", "values": [128, 256, 512] },
    { "name": "HLSLPERF_ELEMENTS_PER_THREAD", "values": [1, 4] },
    { "name": "HLSLPERF_VECTOR_WIDTH", "values": [1, 4] },
    {
      "name": "HLSLPERF_HISTOGRAM_REPLICAS",
      "values": [1, 2, 4],
      "when": { "HLSLPERF_HISTOGRAM_BACKEND": [2] }
    }
  ],
  "constraints": [
    {
      "if": { "HLSLPERF_VECTOR_WIDTH": [4] },
      "then": { "HLSLPERF_ELEMENTS_PER_THREAD": [4] }
    }
  ]
}
